Key,Item Type,Publication Year,Author,Title,Publication Title,ISBN,ISSN,DOI,Url,Abstract Note,Date,Date Added,Date Modified,Access Date,Pages,Num Pages,Issue,Volume,Number Of Volumes,Journal Abbreviation,Short Title,Series,Series Number,Series Text,Series Title,Publisher,Place,Language,Rights,Type,Archive,Archive Location,Library Catalog,Call Number,Extra,Notes,File Attachments,Link Attachments,Manual Tags,Automatic Tags,Editor,Series Editor,Translator,Contributor,Attorney Agent,Book Author,Cast Member,Commenter,Composer,Cosponsor,Counsel,Interviewer,Producer,Recipient,Reviewed Author,Scriptwriter,Words By,Guest,Number,Edition,Running Time,Scale,Medium,Artwork Size,Filing Date,Application Number,Assignee,Issuing Authority,Country,Meeting Name,Conference Name,Court,References,Reporter,Legal Status,Priority Numbers,Programming Language,Version,System,Code,Code Number,Section,Session,Committee,History,Legislative Body
MD2Z6HLT,journalArticle,2023,"Stettinius, Alexia; Holmes, Hal; Zhang, Qian; Mehochko, Isabelle; Winters, Misa; Hutchison, Ruby; Maxwell, Adam; Holliday, Jason; Vlaisavljevich, Eli",DNA release from plant tissue using focused ultrasound extraction (FUSE),Applications in Plant Sciences,,2168-0450,10.1002/aps3.11510,https://onlinelibrary.wiley.com/doi/abs/10.1002/aps3.11510,"Premise Sample preparation in genomics is a critical step that is often overlooked in molecular workflows and impacts the success of downstream genetic applications. This study explores the use of a recently developed focused ultrasound extraction (FUSE) technique to enable the rapid release of DNA from plant tissues for genetic analysis. Methods FUSE generates a dense acoustic cavitation bubble cloud that pulverizes targeted tissue into acellular debris. This technique was applied to leaf samples of American chestnut (Castanea dentata), tulip poplar (Liriodendron tulipifera), red maple (Acer rubrum), and chestnut oak (Quercus montana). Results We observed that FUSE can extract high quantities of DNA in 9–15 min, compared to the 30 min required for control DNA extraction methods. FUSE extracted DNA quantities of 24.33 ± 6.51 ng/mg and 35.32 ± 9.21 ng/mg from American chestnut and red maple, respectively, while control methods yielded 6.22 ± 0.87 ng/mg and 11.51 ± 1.95 ng/mg, respectively. The quality of the DNA released by FUSE allowed for successful amplification and next-generation sequencing. Discussion These results indicate that FUSE can improve DNA extraction efficiency for leaf tissues. Continued development of this technology aims to adapt to field-deployable systems to increase the cataloging of genetic biodiversity, particularly in low-resource biodiversity hotspots.",2023,29/05/24 8:32,29/05/24 8:33,29/05/24 8:32,e11510,,1,11,,,,,,,,,,en,© 2023 The Authors. Applications in Plant Sciences published by Wiley Periodicals LLC on behalf of Botanical Society of America.,,,,Wiley Online Library,,_eprint: https://onlinelibrary.wiley.com/doi/pdf/10.1002/aps3.11510,,/Users/nelly/Zotero/storage/TYDQRVK7/Stettinius et al. - 2023 - DNA release from plant tissue using focused ultras.pdf; ; /Users/nelly/Zotero/storage/L4JFTA4C/aps3.html,notion://www.notion.so/Stettinius-et-al-2023-25871320d75b4e14b5f5fdce48be45e4,notion,genomics; DNA extraction; focused ultrasound; plant genetics,,,,,,,,,,,,,,,,,,,,,,,,,,,,,,,,,,,,,,,,,,,,,,
GGVIV5AM,journalArticle,2012,"Li, Guoqing; Liu, Changcheng; Liu, Yuguo; Yang, Jun; Zhang, Xinshi; Guo, Ke","Effects of climate, disturbance and soil factors on the potential distribution of Liaotung oak (Quercus wutaishanica Mayr) in China",Ecological Research,,1440-1703,10.1007/s11284-011-0914-4,https://doi.org/10.1007/s11284-011-0914-4,"Liaotung oak (strictly named as Quercus wutaishanica Mayr, but usually called Q. liaotungensis Koidz) is the main dominant tree species in deciduous broad-leaved forests and mixed coniferous and broad-leaved forests occupying the warm-temperate zone and temperate zone of China. It plays important roles in soil and water conservation. We collected occurrence data of Liaotung oak together with environmental variables, and used 24 environmental layers as indicators of climate, human disturbance and soil characteristics (at a spatial resolution of 5 arc-min) across China. The genetic algorithm for rule-set prediction (GARP) was used to predict the potential distribution area of Liaotung oak. Forward selection, Monte Carlo permutation tests and variation partitioning methods were used to identify the key environmental factors that determined the distribution pattern of Liaotung oak. The results show that (1) GARP predicts the potential distribution area of Liaotung oak with high accuracy, with areas under the receiver operating characteristic curve (AUC) and Kappa index values being relatively high (0.96 ± 0.01, 0.91 ± 0.01); (2) the highest probability of Liaotung oak occurrence is located mainly in Gansu, Shaanxi, Shanxi, Henan, Shandong, Hebei, Liaoning, Jilin, and Heilongjiang provinces in China; (3) climate and disturbance intensity are predominant in determining the geographical boundary of Liaotung oak, with human footprint and precipitation of the coldest quarter being the most important (both explaining 71% variation) among the factors investigated across continental China. While climate and soil factors play important roles in determining the suitability index of Liaotung oak, soil organic carbon and temperature are the critical factors (both explaining 55% variation) among the factors investigated across the potential distribution area.",01/03/12,29/05/24 9:47,29/05/24 9:47,29/05/24 9:47,427-436,,2,27,,Ecol Res,,,,,,,,en,,,,,Springer Link,,,,"/Users/nelly/Zotero/storage/SWX6LLMX/Li et al. - 2012 - Effects of climate, disturbance and soil factors o.pdf; ",notion://www.notion.so/Li-et-al-2012-a80878135dc14a03b97695618ba731f9,notion,Species distribution modeling; Ecological niche modeling; Quercus liaotungensis; Quercus wutaishanica; Variation partition,,,,,,,,,,,,,,,,,,,,,,,,,,,,,,,,,,,,,,,,,,,,,,
5R5ZWWSG,journalArticle,2017,"Gharehaghaji, Maryam; Minor, Emily S.; Ashley, Mary V.; Abraham, Saji T.; Koenig, Walter D.",Effects of landscape features on gene flow of valley oaks (Quercus lobata),Plant Ecology,,1573-5052,10.1007/s11258-017-0705-2,https://doi.org/10.1007/s11258-017-0705-2,"Landscape features affect habitat connectivity and patterns of gene flow and hence influence genetic structure among populations. We studied valley oak (Quercus lobata), a threatened species of California (USA) savannas and oak woodlands, with a distribution forming a ring around the Central Valley grasslands. Our main goal was to determine the role of topography and land cover on patterns of gene flow and to test whether elevation or land cover forms stronger barriers to gene flow among valley oak populations. We sampled valley oaks in 12 populations across the range of this species, genotyped each tree at eight nuclear microsatellite loci, and created a series of resistance surfaces by assigning different resistance values to land cover type and elevation. We also estimated recent migration rates and evaluated them with regard to landscape features. There was a significant but weak relationship between Euclidian distance and genetic distance. There was no relationship between genetic distances and land cover, but a significant relationship between genetic distances and elevation resistance. We conclude that gene flow is restricted by high elevations in the northern part of the valley oak range and by high elevations and the Central Valley further south. Migration rate analysis indicated some gene flow occurring east–west but we suggest that the high connectivity in the northern Central Valley is facilitating the formation of these links. We predict that southern populations may become more differentiated in the future through genetic isolation and local adaptation taking place in the face of climate change.",01/04/17,29/05/24 9:45,29/05/24 9:46,29/05/24 9:45,487-499,,4,218,,Plant Ecol,,,,,,,,en,,,,,Springer Link,,,,/Users/nelly/Zotero/storage/JBDJIFT4/Gharehaghaji et al. - 2017 - Effects of landscape features on gene flow of vall.pdf; ,notion://www.notion.so/Gharehaghaji-et-al-2017-e2006bf9edd543148e108e99f738d23a,notion,Gene flow; Landscape genetics; Circuit theory; Landscape resistance; Topography; Valley oak,,,,,,,,,,,,,,,,,,,,,,,,,,,,,,,,,,,,,,,,,,,,,,
75QIGVUV,journalArticle,2005,Jian-Wei Zheng; Shu-Qing An; Lin Chen; Xin Leng; Zhong-Sheng Wang; Hua-Jun Xiang,"Effects of Logging on the Genetic Diversity of Quercus tiaoloshanica Chun et Ko in a Tropical Montane Forest of Hainan Island, Southern China",Journal of Integrative Plant Biology,,16729072,10.1111/j.1744-7909.2005.00143.x,http://pbidi.unam.mx:8080/login?url=https://search.ebscohost.com/login.aspx?direct=true&db=asn&AN=18527182&lang=es&site=eds-live,"Quercus tiaoloshanica Chun et Ko, which has a narrow range of distribution, is one of the important endemic species of the tropical montane rain forest on Hainan Island, southern China. Long-term logging and habitat destruction have resulted in population decline and distribution retreat of Q. tiaoloshanica. To determine the impact of logging on the genetic diversity of Q. tiaoloshanica, the authors investigated the genetic structures using amplified fragment length polymorphism markers in four regenerated stands after logging and in one unlogged stand. Compared with the unlogged stand, the effective number of alleles per locus dropped by 1.0% in selective logging stands and by 2.0% in clear logging stands, corresponding to reductions of 3.8% and 5.2%, respectively, in mean Nei's gene diversity and 2.9% and 3.5%, respectively, in mean Shannon diversity index. No substantial genetic erosion was detected in any of the regenerated stands owing to the high tree density and high heterogeneity of the Q. tiaoloshanica stands investigated. Meanwhile, there was no natural regeneration of the species observed in a Dacrydium pierrei Hickel plantation 700 m away from the regenerated stands, suggesting the limited ability of seed dispersal of Q. tiaoloshanica. Clear logging should be undertaken cautiously because the total number of plant species dropped by 15.2% in the clear-logged stands compared with the unlogged stand. To conserve the genetic diversity of this species, as well as the plant biodiversity of tropical forests, the habitats of Q. tiaoloshanica should be protected against exploitation in terms of agricultural or other forms of land use, and some mature trees should be preserved as seed sources to maintain an adequate regeneration base for this species in the management of logging. (Managing editor: Ya-Qin HAN)",2005-10,30/05/24 6:04,30/05/24 6:04,30/05/24 6:04,1184-1192,,10,47,,,,,,,,,,,,,,,EBSCOhost,,Publisher: Wiley-Blackwell,,/Users/nelly/Zotero/storage/JCW6V347/Jian-Wei Zheng et al. - 2005 - Effects of Logging on the Genetic Diversity of Que.pdf; ,notion://www.notion.so/Jian-Wei-Zheng-et-al-2005-295fab891d354377a713671970dbee84,notion,amplified fragment length polymorphism; BIODIVERSITY; CHINA; genetic erosion; HAINAN Sheng (China); logging; LOGGING; PHYTOGEOGRAPHY; PLANT diversity; Quercus tiaoloshanica; tropical forest,,,,,,,,,,,,,,,,,,,,,,,,,,,,,,,,,,,,,,,,,,,,,,
2KYGZJUT,journalArticle,2006,"Mir, C.; Toumi, L.; Jarne, P.; Sarda, V.; Di Giusto, F.; Lumaret, R.",Endemic North African Quercus afares Pomel originates from hybridisation between two genetically very distant oak species (Q. suber L. and Q. canariensis Willd.): evidence from nuclear and cytoplasmic markers,Heredity,,1365-2540,10.1038/sj.hdy.6800782,https://www.nature.com/articles/6800782,"Hybridisation is a potent force in plant evolution, although there are few reported examples of stabilised species that have been created through homoploid hybridisation. We focus here on Quercus afares, an endemic North African species that combines morphological, physiological and ecological traits of both Q. suber and Q. canariensis, two phylogenetically distant species. These two species are sympatric with Q. afares over most of its distribution. We studied two Q. afares populations (one from Algeria and one from Tunisia), as well as several populations of both Q. suber and Q. canariensis sampled both within and outside areas where these species overlap with Q. afares. A genetic analysis was conducted using both nuclear (allozymes) and chloroplastic markers, which shows that Q. afares originates from a Q. suber × Q. canariensis hybridisation. At most loci, Q. afares predominantly possesses alleles from Q. suber, suggesting that the initial cross between Q. suber and Q. canariensis was followed by backcrossing with Q. suber. Other hypotheses that can account for this result, including genetic drift, gene silencing, gene conversion and selection, are discussed. A single Q. suber chlorotype was detected, and all Q. afares individuals displayed this chlorotype, indicating that Q. suber was the maternal parent. Q. afares is genetically, morphologically and ecologically differentiated from its parental species, and can therefore be considered as a stabilised hybrid species.",2006-02,29/05/24 21:38,29/05/24 21:38,29/05/24 21:38,175-184,,2,96,,,Endemic North African Quercus afares Pomel originates from hybridisation between two genetically very distant oak species (Q. suber L. and Q. canariensis Willd.),,,,,,,en,2006 The Genetics Society,,,,www.nature.com,,Publisher: Nature Publishing Group,,/Users/nelly/Zotero/storage/Q7GJYTJE/Mir et al. - 2006 - Endemic North African Quercus afares Pomel origina.pdf; ,notion://www.notion.so/Mir-et-al-2006-a8f9d780fd6b4aeb87fc5310dc20cbdf,notion,Biomedicine; general; Human Genetics; Cytogenetics; Ecology; Evolutionary Biology; Plant Genetics and Genomics,,,,,,,,,,,,,,,,,,,,,,,,,,,,,,,,,,,,,,,,,,,,,,
8KXNPCZE,journalArticle,2020,"Nagamitsu, Teruyoshi; Uchiyama, Kentaro; Izuno, Ayako; Shimizu, Hajime; Nakanishi, Atsushi",Environment-dependent introgression from Quercus dentata to a coastal ecotype of Quercus mongolica var. crispula in northern Japan,New Phytologist,,1469-8137,10.1111/nph.16131,https://onlinelibrary.wiley.com/doi/abs/10.1111/nph.16131,"Introgression from one species in a specific environment to another may facilitate colonization of the environment by the recipient species. However, such environment-dependent introgression has been clarified in limited plant taxa. In northern Japan, there are two interfertile oak species: Quercus dentata (Qd) in coastal areas and Q. mongolica var. crispula (Qc) in inland areas. However, at higher latitudes where Qd is rare, a coastal Qc ecotype with Qd-like traits is distributed in the coastal areas. We distinguished inland Qc, coastal Qc, and coastal Qd populations based on genome-wide genotypes and multitrait phenotypes and verified introgression from coastal Qd to coastal Qc using reduced library sequencing. Genotypes and phenotypes differed among the populations, and coastal Qc was intermediate between inland Qc and coastal Qd. The ABBA–BABA test showed introgression from coastal Qd to coastal Qc. In coastal Qc, we found various stages of introgression after the first generation of backcross but detected no genomic regions where introgression was enhanced. Overall, we show evidence for introgression from a coastal species to an ecotype of an inland species, which has colonized the coastal environment. It remains unclear whether introgressed alleles are selected in the coastal environment.",2020,30/05/24 7:26,30/05/24 7:27,30/05/24 7:26,1018-1028,,4,226,,,,,,,,,,,© 2019 The Authors. New Phytologist © 2019 New Phytologist Trust,,,,Wiley Online Library,,_eprint: https://onlinelibrary.wiley.com/doi/pdf/10.1111/nph.16131,,/Users/nelly/Zotero/storage/JQDEMRWY/Nagamitsu et al. - 2020 - Environment-dependent introgression from Quercus d.pdf; ; /Users/nelly/Zotero/storage/JL97BXE2/nph.html,notion://www.notion.so/Nagamitsu-et-al-2020-75f3164ab1e4461998c73450446d71e6,notion,principal component analysis; heterozygosity; ancestry proportion; coastal stress; double-digest restriction-site-associated DNA (ddRAD) sequencing; morphological traits; Patterson's D; Weir–Cockerham's FST,,,,,,,,,,,,,,,,,,,,,,,,,,,,,,,,,,,,,,,,,,,,,,
NNTPBERZ,journalArticle,2015,"Pérez, Marta; Viejo, Marcos; LaCuesta, Maite; Toorop, Peter; Cañal, María Jesús",Epigenetic and hormonal profile during maturation of <i>Quercus Suber</i> L. somatic embryos,Journal of Plant Physiology,,0176-1617,10.1016/j.jplph.2014.07.028,https://www.sciencedirect.com/science/article/pii/S0176161714002442,"Somatic embryogenesis is a powerful alternative to conventional mass propagation of Quercus suber L. However, poor quality and incomplete maturation of somatic embryos restrict any application. Given that epigenetic and hormonal control govern many developmental stages, including maturation of zygotic embryos, global DNA methylation and abscisic acid (ABA) were analyzed during development and maturation of cork oak somatic embryos. Our results indicated that development of somatic embryos concurred with a decrease in 5-mdC. In contrast, endogenous ABA content showed a transient increase with a peak in immature E2 embryos denoting the onset of the maturation phase. A cold stratification phase was necessary for embryos to acquire germination ability, which coincided with a significant decrease in 5-mdC and ABA content. Immunohistochemical analyses showed that there was a specific spatial-temporal regulation during embryogenesis, particularly after the cold treatment. The acquisition of germination capacity concurred with a general low 5-mdC signal in the root meristem, while retention of the 5-mdC signal was mainly located in the shoot meristem and provascular tissues. Conversely, ABA immunolocalization was mainly located in the root and shoot apical meristems. Furthermore, a strong decrease in the ABA signal was observed in the root cap after the stratification treatment suggesting a role for the root cap during development of somatic embryos. These results suggest that, in addition to ABA, epigenetic control appears to play an important role for the correct maturation and subsequent germination of cork oak somatic embryos.",15/01/15,29/05/24 19:41,29/05/24 19:41,29/05/24 19:41,51-61,,,173,,Journal of Plant Physiology,,,,,,,,,,,,,ScienceDirect,,,,; /Users/nelly/Zotero/storage/IC4TW7FE/S0176161714002442.html,notion://www.notion.so/P-rez-et-al-2015-532a29d391d744918f0b454c267bd928,notion,DNA methylation; ABA; Immunolocalization; Maturation; Somatic embryogenesis,,,,,,,,,,,,,,,,,,,,,,,,,,,,,,,,,,,,,,,,,,,,,,
7H57TDXM,journalArticle,2013,"Vičić, V.; Barišić, D.; Horvat, T.; Biruš, I.; Zoldos, Vlatka","Epigenetic characterization of chromatin in cycling cells of pedunculate oak, Quercus robur L.",Tree Genetics & Genomes,,1614-2950,10.1007/s11295-013-0632-x,https://doi.org/10.1007/s11295-013-0632-x,"Cycling cells of Quercus robur have a simple nuclear organization where most of the heterochromatin is visible as DAPI-positive chromocenters, which correspond to DAPI bands at the (peri)centromeric region of each of the 24 chromosomes of the oak complement. Immunofluorescence using 5-mC revealed dispersed distribution of the signal throughout the interphase nucleus/chromosomes without enrichment within DAPI-positive chromocenters/bands, suggesting that DNA methylation was not restricted to constitutive heterochromatin, but was associated with both euchromatic and heterochromatic domains. While H3K9ac exhibited typical euchromatin-specific distribution, the distributional pattern of histone methylation marks H3K9me1, H3K27me2, and H3K4me3 showed some specificity. The H3K9me1 and H3K27me2, both heterochromatin-associated marks, were not restricted to chromocenters, but showed additional dispersed distribution within euchromatin, while H3K27me2 mark also clustered in foci that did not co-localize with chromocenters. Surprisingly, even though H3K4me3 was distributed in the entire chromatin, many chromocenters were enriched with this euchromatin-specific modification. We discuss the distribution of the epigenetic marks in the context of the genome composition and lifestyle of Q. robur.",01/10/13,29/05/24 9:51,29/05/24 9:52,29/05/24 9:51,1247-1256,,5,9,,Tree Genetics & Genomes,,,,,,,,en,,,,,Springer Link,,,,/Users/nelly/Zotero/storage/ZAWI98EI/Vičić et al. - 2013 - Epigenetic characterization of chromatin in cyclin.pdf; ,notion://www.notion.so/Vi-i-et-al-2013-2f990879e06d416fac6e49dd60aff7fa,notion,DNA methylation; Quercus robur; Chromocenters; Epigenetics; Histone acetylation; Histone methylation; Interphase chromatin,,,,,,,,,,,,,,,,,,,,,,,,,,,,,,,,,,,,,,,,,,,,,,
8C95ILWR,journalArticle,2011,"Moran, Emily V.; Clark, James S.",Estimating seed and pollen movement in a monoecious plant: a hierarchical Bayesian approach integrating genetic and ecological data,Molecular Ecology,,1365-294X,10.1111/j.1365-294X.2011.05019.x,https://onlinelibrary.wiley.com/doi/abs/10.1111/j.1365-294X.2011.05019.x,"The scale of seed and pollen movement in plants has a critical influence on population dynamics and interspecific interactions, as well as on their capacity to respond to environmental change through migration or local adaptation. However, dispersal can be challenging to quantify. Here, we present a Bayesian model that integrates genetic and ecological data to simultaneously estimate effective seed and pollen dispersal parameters and the parentage of sampled seedlings. This model is the first developed for monoecious plants that accounts for genotyping error and treats dispersal from within and beyond a plot in a fully consistent manner. The flexible Bayesian framework allows the incorporation of a variety of ecological variables, including individual variation in seed production, as well as multiple sources of uncertainty. We illustrate the method using data from a mixed population of red oak (Quercus rubra, Q. velutina, Q. falcata) in the NC piedmont. For simulated test data sets, the model successfully recovered the simulated dispersal parameters and pedigrees. Pollen dispersal in the example population was extensive, with an average father–mother distance of 178 m. Estimated seed dispersal distances at the piedmont site were substantially longer than previous estimates based on seed-trap data (average 128 m vs. 9.3 m), suggesting that, under some circumstances, oaks may be less dispersal-limited than is commonly thought, with a greater potential for range shifts in response to climate change.",2011,30/05/24 5:02,30/05/24 5:02,30/05/24 5:02,1248-1262,,6,20,,,Estimating seed and pollen movement in a monoecious plant,,,,,,,en,© 2011 Blackwell Publishing Ltd,,,,Wiley Online Library,,_eprint: https://onlinelibrary.wiley.com/doi/pdf/10.1111/j.1365-294X.2011.05019.x,,/Users/nelly/Zotero/storage/V8MIGXAG/Moran y Clark - 2011 - Estimating seed and pollen movement in a monoeciou.pdf; ; /Users/nelly/Zotero/storage/8TA66LUC/j.1365-294x.2011.05019.html,notion://www.notion.so/Moran-Clark-2011-1cc0501855be4d6dad30a54eb25ff9c6,notion,Quercus; microsatellites; population ecology; hierarchical Bayesian models; parentage; seed dispersal,,,,,,,,,,,,,,,,,,,,,,,,,,,,,,,,,,,,,,,,,,,,,,
WU4BT7ZE,journalArticle,2016,"Backs, Janet Rizner; Ashley, Mary V.",Evolutionary history and gene flow of an endemic island oak: Quercus pacifica,American Journal of Botany,,1537-2197,10.3732/ajb.1600259,https://onlinelibrary.wiley.com/doi/abs/10.3732/ajb.1600259,"PREMISE OF THE STUDY: Understanding historical patterns of colonization and subsequent gene flow clarifies the evolutionary origins and history of endemic island species. METHODS: Here we use DNA microsatellite markers to characterize the genetic structure of the island endemic species Quercus pacifica K. Nixon & C.H. Mull., found on three of the California Channel Islands, and to examine its relationship to two mainland oaks, Q. berberidifolia and Q. dumosa. KEY RESULTS: We found that Q. pacifica is a genetically cohesive and differentiated evolutionary lineage, diverging from mainland scrub oaks in the Pleistocene with little subsequent introgression. Genetic differentiation of Q. pacifica among islands is small but significant. Both recent and historical gene flow were surprisingly high considering the disjunct distribution of Q. pacifica on islands separated by as much as 125 km of open ocean. Gene flow estimates were highest between the two northern islands and from the northern islands to Santa Catalina. While there is no evidence of recent bottlenecks, historical bottlenecks are indicated on each of the islands. CONCLUSIONS: The genetic cohesiveness of the Q. pacifica species suggests allopatric speciation on the islands with subsequent gene flow that has maintained genetic continuity over great distances.",2016,31/05/24 4:10,31/05/24 4:10,31/05/24 4:10,2115-2125,,12,103,,,Evolutionary history and gene flow of an endemic island oak,,,,,,,en,© 2016 Botanical Society of America,,,,Wiley Online Library,,_eprint: https://onlinelibrary.wiley.com/doi/pdf/10.3732/ajb.1600259,,/Users/nelly/Zotero/storage/Q3S5ILQ8/Backs y Ashley - 2016 - Evolutionary history and gene flow of an endemic i.pdf; ; /Users/nelly/Zotero/storage/P4YB7PU2/ajb.html,notion://www.notion.so/Backs-Ashley-2016-29802c66599f46eea2007fe2d8cb9617,notion,California scrub oaks; gene flow; genetic structure; insular genetic isolation; island endemic; microsatellites; Quercus pacifica,,,,,,,,,,,,,,,,,,,,,,,,,,,,,,,,,,,,,,,,,,,,,,
