Key,Item Type,Publication Year,Author,Title,Publication Title,ISBN,ISSN,DOI,Url,Abstract Note,Date,Date Added,Date Modified,Access Date,Pages,Num Pages,Issue,Volume,Number Of Volumes,Journal Abbreviation,Short Title,Series,Series Number,Series Text,Series Title,Publisher,Place,Language,Rights,Type,Archive,Archive Location,Library Catalog,Call Number,Extra,Notes,File Attachments,Link Attachments,Manual Tags,Automatic Tags,Editor,Series Editor,Translator,Contributor,Attorney Agent,Book Author,Cast Member,Commenter,Composer,Cosponsor,Counsel,Interviewer,Producer,Recipient,Reviewed Author,Scriptwriter,Words By,Guest,Number,Edition,Running Time,Scale,Medium,Artwork Size,Filing Date,Application Number,Assignee,Issuing Authority,Country,Meeting Name,Conference Name,Court,References,Reporter,Legal Status,Priority Numbers,Programming Language,Version,System,Code,Code Number,Section,Session,Committee,History,Legislative Body
LX82XYPD,journalArticle,2006,"Neves, Clélia; Hand, Paul; Amâncio, Sara",Patterns of B-type cyclin gene expression during adventitious rooting of micropropagated cork oak,"Plant Cell, Tissue and Organ Culture",,1573-5044,10.1007/s11240-006-9119-x,https://doi.org/10.1007/s11240-006-9119-x,"The aim of our study is the identification of the critical points in the rooting process at the molecular level for possible improvement of the propagation of cork oak. The rhizogenic potential of woody plants depends on both genotype and developmental stage. To investigate the role of cyclin transcription in the regulation of cell division during adventitious root induction, we have analysed the temporal expression of a member of the cyclin gene family. The histological modifications that occur during the root induction and formation processes as a consequence of auxin treatments can be detected by the technique of tissue printing for hydrogen peroxide (H2O2). Thus a H2O2 printing assay was performed in parallel with cyclin expression studies. We report the cloning and sequencing of a B-type cyclin genomic fragment from micropropagated cork oak using gene-specific and genotype-independent oligonucleotide primers to conserved regions of the gene. After 48 h of auxin induction, the expression of this B-type cyclin increased, possibly in association with the first cell divisions. The expression observed in control shoots may reflect unorganised cell divisions associated with callus formation.",01/09/06,29/05/24 9:44,29/05/24 9:45,29/05/24 9:44,367-374,,3,86,,Plant Cell Tiss Organ Cult,,,,,,,,en,,,,,Springer Link,,,,/Users/nelly/Zotero/storage/7EQCTE5Q/Neves et al. - 2006 - Patterns of B-type cyclin gene expression during a.pdf; ,notion://www.notion.so/Neves-et-al-2006-874cfb61b8c94c2ca40e821d6740ca83,notion,Auxin; Hydrogen peroxide (H2O2); Quercus suber L.; Rooting markers; Tissue-printing,,,,,,,,,,,,,,,,,,,,,,,,,,,,,,,,,,,,,,,,,,,,,,
QKW6DPIN,journalArticle,2009,"Marsico, Travis D.; Hellmann, Jessica J.; Romero-Severson, Jeanne",Patterns of seed dispersal and pollen flow in Quercus garryana (Fagaceae) following post-glacial climatic changes,Journal of Biogeography,,1365-2699,10.1111/j.1365-2699.2008.02049.x,https://onlinelibrary.wiley.com/doi/abs/10.1111/j.1365-2699.2008.02049.x,"Aim We examined the genetic structure of Quercus garryana to infer post-glacial patterns of seed dispersal and pollen flow to test the hypotheses that (1) peripheral populations are genetically distinct from core populations and from one another; (2) genetic diversity declines towards the poleward edge of the species’ range; and (3) genetic diversity in the chloroplast genome, a direct measure of seed dispersal patterns, declines more sharply with increasing latitude than diversity in the nuclear genome. We address our findings in the context of known historical oak distribution from pollen core data derived from previously published research. Location Oak–savanna ecosystems from southern Oregon, USA (core populations/non-glaciated range) northward to Vancouver Island, British Columbia, Canada (peripheral populations/glaciated range). Methods We genotyped 378 trees from 22 sites with five chloroplast and seven nuclear microsatellite loci. For both sets of markers, we estimated genetic diversity and differentiation using an analysis of molecular variance and generated Mantel correlograms to detect genetic and geographical distance correlations. For the nuclear markers, we also used a Bayesian approach to infer population substructure. Results There was a large degree of population differentiation revealed by six chloroplast haplotypes, with little (≤ 3) or no haplotype diversity within sites. Peripheral island locations shared the same, maternally inherited chloroplast haplotype, whereas locations in mainland Washington had greater haplotype diversity. In contrast, genetic diversity of the nuclear markers was high at all locations sampled. Populations clustered into two groups and were significantly positively correlated over large spatial scales (≤ 200 km), although allele richness decreased significantly with latitude. Population substructure was observed between core and peripheral populations because rare alleles were absent in peripheral localities and common allele frequencies differed. Main conclusions The observed pattern of chloroplast haplotype loss at the northern periphery suggests restricted seed dispersal events from mainland sites to peripheral islands. This pattern was unexpected, however, as refugial oak populations remained near the current post-glacial range even during the Last Glacial Maximum. Using nuclear markers, we found high within-population diversity and population differentiation only over large spatial scales, suggesting that pollen flow is relatively high among populations.",2009,30/05/24 4:33,30/05/24 4:33,30/05/24 4:33,929-941,,5,36,,,,,,,,,,en,© 2009 The Authors. Journal compilation © 2009 Blackwell Publishing Ltd,,,,Wiley Online Library,,_eprint: https://onlinelibrary.wiley.com/doi/pdf/10.1111/j.1365-2699.2008.02049.x,,/Users/nelly/Zotero/storage/225MLIKH/Marsico et al. - 2009 - Patterns of seed dispersal and pollen flow in Quer.pdf; ; /Users/nelly/Zotero/storage/WT2QY7TW/j.1365-2699.2008.02049.html,notion://www.notion.so/Marsico-et-al-2009-2649ec36222c44a4bb0bb580793f5c73,notion,oak; North America; microsatellite; Quercus garryana; peripheral populations; Genetic differentiation; glacial refugia; latitudinal gradient; post-glacial migration; range shift,,,,,,,,,,,,,,,,,,,,,,,,,,,,,,,,,,,,,,,,,,,,,,
99YSL4HB,journalArticle,2017,"Fitz-Gibbon, Sorel; Hipp, Andrew L.; Pham, Kasey K.; Manos, Paul S.; Sork, Victoria L.; Jaramillo-Correa, Juan P.",Phylogenomic inferences from reference-mapped and de novo assembled short-read sequence data using RADseq sequencing of California white oaks ( Quercus section Quercus),Genome,,8312796,10.1139/gen-2016-0202,http://pbidi.unam.mx:8080/login?url=https://search.ebscohost.com/login.aspx?direct=true&db=asn&AN=125066073&lang=es&site=eds-live,"The emergence of next generation sequencing has increased by several orders of magnitude the amount of data available for phylogenetics. Reduced representation approaches, such as restriction-sited associated DNA sequencing (RADseq), have proven useful for phylogenetic studies of non-model species at a wide range of phylogenetic depths. However, analysis of these datasets is not uniform and we know little about the potential benefits and drawbacks of de novo assembly versus assembly by mapping to a reference genome. Using RADseq data for 83 oak samples representing 16 taxa, we identified variants via three pipelines: mapping sequence reads to a recently published draft genome of Quercus lobata, and de novo assembly under two sets of locus filters. For each pipeline, we inferred the maximum likelihood phylogeny. All pipelines produced similar trees, with minor shifts in relationships within well-supported clades, despite the fact that they yielded different numbers of loci (68 000 - 111 000 loci) and different degrees of overlap with the reference genome. We conclude that both the reference-aligned and de novo assembly pipelines yield reliable results, and that advantages and disadvantages of these approaches pertain mainly to downstream uses of RADseq data, not to phylogenetic inference per se. (English)",2017-09,30/05/24 23:45,30/05/24 23:45,30/05/24 23:45,743-755,,9,60,,,,,,,,,,,,,,,EBSCOhost,,Publisher: Canadian Science Publishing,,/Users/nelly/Zotero/storage/UMGLZ2JC/Fitz-Gibbon et al. - 2017 - Phylogenomic inferences from reference-mapped and .pdf; ,notion://www.notion.so/Fitz-Gibbon-et-al-2017-d596d6e0b391462197993f1e973ef1c1,notion,de novo clustering; GATK; groupement de novo; identification de variants; NUCLEOTIDE sequencing; PHYLOGENETIC models; phylogenetics; phylogénétique; PHYLOGENY; PyRAD; restriction-site associated DNA sequencing; séquençage de l'ADN associé aux sites de restriction; VALLEY oak; variant discovery; WHITE oak,,,,,,,,,,,,,,,,,,,,,,,,,,,,,,,,,,,,,,,,,,,,,,
NVQDXFB9,journalArticle,2018,"Deng, Min; Jiang, Xiao-Long; Hipp, Andrew L.; Manos, Paul S.; Hahn, Marlene",Phylogeny and biogeography of East Asian evergreen oaks (<i>Quercus</i> section <i>Cyclobalanopsis</i>; Fagaceae): Insights into the Cenozoic history of evergreen broad-leaved forests in subtropical Asia,Molecular Phylogenetics and Evolution,,1055-7903,10.1016/j.ympev.2017.11.003,https://www.sciencedirect.com/science/article/pii/S1055790317304050,"The evolutionary history of Quercus section Cyclobalanopsis, a dominant lineage in East Asian evergreen broadleaved forests (EBLFs), has not been comprehensively studied using molecular tools. In this study, we reconstruct the first comprehensive phylogeny of this lineage using a genomic approach (restriction-site associated DNA sequencing, RAD-seq), sampling 35 of the ca. 90 species currently recognized, representing all main morphological groups of section Cyclobalanopsis. In addition, 10 other species of Quercus and two outgroups were also sampled. Divergence times were estimated using a relaxed clock model and two fossil calibrations. Ancestral areas and dispersal routes were inferred using statistical dispersal-vicariance analysis and the dispersal-extinction-cladogenesis (DEC) model. The phylogeny of Quercus section Cyclobalanopsis demonstrates the section to be monophyletic, comprising two main lineages and six subclades that are well supported by anatomical traits. Biogeographical reconstructions indicate that the wide northern hemisphere distribution of Quercus was disrupted in the Late Eocene, leading to the main extant groups at about 33 Ma. The earliest divergences in section Cyclobalanopsis correspond to the phased uplift of the Himalayas and lateral extrusion of Indochina at the transition of the Oligocene and Miocene, where the highest rate of diversification occurred in the late Miocene. Dispersal from Sino-Himalaya and the Palaeotropics to Sino-Japan in the Miocene was facilitated by the increased intensity of East Asian summer monsoons and by the Middle Miocene Climatic Optimum. Our results highlight the importance of climatic changes and Indo-Eurasian collision-induced tectonic activities from the Neogene onward to the spatial-temporal diversification patterns of Asian EBLF lineages.",01/02/18,29/05/24 20:08,29/05/24 20:08,29/05/24 20:08,170-181,,,119,,Molecular Phylogenetics and Evolution,Phylogeny and biogeography of East Asian evergreen oaks (<i>Quercus</i> section <i>Cyclobalanopsis</i>; Fagaceae),,,,,,,,,,,,ScienceDirect,,,,; /Users/nelly/Zotero/storage/6T3X9MLT/S1055790317304050.html,notion://www.notion.so/Deng-et-al-2018-622550e7cb514adb959d1de642fa1db4,notion,Phylogeny; Biogeography; Divergence times; Evergreen broadleaved forests (EBLFs); Restriction site associated DNA (RAD-seq),,,,,,,,,,,,,,,,,,,,,,,,,,,,,,,,,,,,,,,,,,,,,,
6R2F3NN7,journalArticle,2005,"LUMARET, ROSELYNE; TRYPHON-DIONNET, MATHIEU; MICHAUD, HENRI; SANUY, AURÉLIE; IPOTESI, EMILIE; BORN, CÉLINE; MIR, CÉLINE",Phylogeographical Variation of Chloroplast DNA in Cork Oak (Quercus suber),Annals of Botany,,0305-7364,10.1093/aob/mci237,https://doi.org/10.1093/aob/mci237,"• Background and Aims In the last decades, the geographical location of the centre of origin of Quercus suber (cork oak), a strictly western Mediterranean oak species, has been the subject of controversy.• Methods RFLP variation over the whole chloroplast DNA molecule and PCR–RFLPs over seven specific cpDNA fragments were analysed phylogeographically to reconstruct the evolutionary history of cork oak.• Key Results Nine chlorotypes of the ‘suber’ cpDNA lineage were identified throughout the species range. Using closely related Mediterranean oak species as outgroup, the chlorotypes showed a clear phylogeographical pattern of three groups corresponding to potential glacial refuges in Italy, North Africa and Iberia. The most ancestral and recent groups were observed in populations located in the eastern and western parts of the species range, respectively. Several unrelated chlorotypes of the ‘ilex’ cpDNA lineage were also identified in specific western areas.• Conclusions The results support a Middle-Eastern or a central Mediterranean origin for cork oak with subsequent westward colonization during the Tertiary Period, and suggest that the ‘ilex’ chlorotype variation does not reflect entirely cytoplasmic introgression by Q. ilex but originated partly in Q. suber.",01/10/05,30/05/24 1:40,30/05/24 1:40,30/05/24 1:40,853-861,,5,96,,Annals of Botany,,,,,,,,,,,,,Silverchair,,,,/Users/nelly/Zotero/storage/KMSNBL46/LUMARET et al. - 2005 - Phylogeographical Variation of Chloroplast DNA in .pdf; ; /Users/nelly/Zotero/storage/I9GA6D26/180669.html,notion://www.notion.so/LUMARET-et-al-2005-f9d9d1e797e24476a84a2f4bf716044c,notion,,,,,,,,,,,,,,,,,,,,,,,,,,,,,,,,,,,,,,,,,,,,,,,
7AVRQIET,journalArticle,2002,"Lumaret, R.; Mir, C.; Michaud, H.; Raynal, V.",Phylogeographical variation of chloroplast DNA in holm oak (Quercus ilex L.),Molecular Ecology,,1365-294X,10.1046/j.1365-294X.2002.01611.x,https://onlinelibrary.wiley.com/doi/abs/10.1046/j.1365-294X.2002.01611.x,"Variation in the lengths of restriction fragments (RFLPs) of the whole chloroplast DNA molecule was studied in 174 populations of Quercus ilex L. sampled over the entire distribution of this evergreen and mainly Mediterranean oak species. By using five endonucleases, 323 distinct fragments were obtained. From the 29 and 17 cpDNA changes identified as site and length mutations, respectively, 25 distinct chlorotypes were distinguished, mapped and treated cladistically with a parsimony analysis, using as an outgroup Q. alnifolia Poech, a closely related evergreen oak species endemic to Cyprus where Q. ilex does not grow. The predominant role of Q. ilex as maternal parent in hybridization with other species was reflected by the occurrence of a single very specific lineage of related chlorotypes, the most ancestral and recent ones being located in the southeastern and in the northwestern parts of the species’ geographical distribution, respectively. The lineage was constituted of two clusters of chlorotypes observed in the ‘ilex’ morphotyped populations of the Balkan and Italian Peninsulas (including the contiguous French Riviera), respectively. A third cluster was divided into two subclusters identified in the ‘rotundifolia’ morphotyped populations of North Africa, and of Iberia and the adjacent French regions, respectively. Postglacial colonization probably started from three distinct southerly refugia located in each of the three European peninsulas, and a contact area between the Italian and the Iberian migration routes was identified in the Rhône valley (France). Chlorotypes identical or related to those of the Iberian cluster were identified in the populations from Catalonia and the French Languedoc region, which showed intermediate morphotypes, and in the French Atlantic populations which possessed the ‘ilex’ morphotype, suggesting the occurrence of adaptive morphological changes in the northern part of the species’ distribution.",2002,29/05/24 21:50,29/05/24 21:50,29/05/24 21:50,2327-2336,,11,11,,,,,,,,,,en,,,,,Wiley Online Library,,_eprint: https://onlinelibrary.wiley.com/doi/pdf/10.1046/j.1365-294X.2002.01611.x,,/Users/nelly/Zotero/storage/Y2CTWUCA/Lumaret et al. - 2002 - Phylogeographical variation of chloroplast DNA in .pdf; ; /Users/nelly/Zotero/storage/A945YYJC/j.1365-294x.2002.01611.html,notion://www.notion.so/Lumaret-et-al-2002-8c5ec9d9400d47fd86259d3ff440742d,notion,phylogeography; cpDNA RFLP variation; evergreen Mediterranean oaks; morphological convergence; Q. ilex L,,,,,,,,,,,,,,,,,,,,,,,,,,,,,,,,,,,,,,,,,,,,,,
ZJFVHQKM,journalArticle,2018,"Rodríguez-Gómez, Flor; Oyama, Ken; Ochoa-Orozco, Magaly; Mendoza-Cuenca, Luis; Gaytán-Legaria, Ricardo; González-Rodríguez, Antonio",Phylogeography and climate-associated morphological variation in the endemic white oak Quercus deserticola (Fagaceae) along the Trans-Mexican Volcanic Belt,Botany,,19162790,10.1139/cjb-2017-0116,http://pbidi.unam.mx:8080/login?url=https://search.ebscohost.com/login.aspx?direct=true&db=asn&AN=127615165&lang=es&site=eds-live,"Mexico is a center of diversification for the genus Quercus, with an important number of taxa occurring along the Trans-Mexican Volcanic Belt (TMVB). However, the impact of the interaction between historical and current climatic variation and geological heterogeneity in the TMVB on the genetic and phenotypic diversification within oak species has been scarcely investigated. We used chloroplast DNA microsatellites and a geometric morphometrics analysis of leaf shape to understand differentiation between populations of Quercus deserticola Trel., which inhabits dry highlands along the TMVB. Ecological niche modeling for present-day conditions and projections into past scenarios were performed to evaluate the influence of environmental variables on the evolutionary history of the species. Results showed high genetic diversity ( hS = 0.774) and high genetic structure ( RST = 0.75) and the morphological subdivision of populations into two clusters, corresponding to the west/south and east/north sectors of the Q. deserticola geographic distribution. Ecological niche modeling indicated that the potential distribution of the species has remained similar from the late Pleistocene to the present. Seemingly, the phylogeographic structure of the species has been shaped by low seed-mediated gene flow and mostly local migration patterns. In turn, leaf shape is responding to climate differences either through phenotypic plasticity or local adaptation. (English)",2018-02,30/05/24 23:28,30/05/24 23:28,30/05/24 23:28,121-133,,2,96,,,,,,,,,,,,,,,EBSCOhost,,Publisher: Canadian Science Publishing,,/Users/nelly/Zotero/storage/ZWIINUFU/Rodríguez-Gómez et al. - 2018 - Phylogeography and climate-associated morphologica.pdf; ,notion://www.notion.so/Rodr-guez-G-mez-et-al-2018-deb4c0f841e84ddebc6d7244c18bbee2,notion,chênes mexicains; dernier maximum glaciaire; ecological niche modeling; ENDEMIC plants; flux génique; gene flow; Last Glacial Maximum; Mexican oaks; modélisation de la niche écologique; PHYLOGEOGRAPHY; PLANT morphology; PLANT size; WHITE oak,,,,,,,,,,,,,,,,,,,,,,,,,,,,,,,,,,,,,,,,,,,,,,
7C9KVJUE,journalArticle,2019,"Chen, Xiao-Dan; Yang, Jia; Feng, Li; Zhou, Tao; Zhang, Hao; Li, Hui-Min; Bai, Guo-Qing; Meng, Xu; Li, Zhong-Hu; Zhao, Gui-Fang",Phylogeography and population dynamics of an endemic oak (Quercus fabri Hance) in subtropical China revealed by molecular data and ecological niche modeling,Tree Genetics & Genomes,,1614-2950,10.1007/s11295-019-1383-0,https://doi.org/10.1007/s11295-019-1383-0,"High numbers of endemic plants exist in subtropical China, but there have been few investigations of the phylogeography and dynamic history for endemic tree species in this region. In this study, we explored the phylogeographic pattern of Quercus fabri, an endemic oak species in subtropical China, to assess the effects of past geographical and climatic changes on the evolutionary history of this deciduous species using three chloroplast DNA (cpDNA) fragments and the internal transcribed spacer region (ITS) and ecological niche modeling (ENM). The cpDNA fragments differentiated three phylogeographical groups among Q. fabri populations. A BEAST-derived chronogram based on the cpDNA haplotypes indicated that the initial divergence of Q. fabri probably occurred during the late Miocene (12.33 Ma), whereas haplotype divergence time could date back to the late Pliocene to early Pleistocene. ENM showed that the suitable areas contracted during the last glacial maximum (LGM) and expanded in the warm period during the Pleistocene. Consistently, both the cpDNA and ITS datasets suggested that population expansion occurred after the LGM period (ca. 13–14 kyr) for Q. fabri. Demographical analyses based on multiple genetic datasets and a coalescent-based method also suggested a shrinkage–expansion trend for the effective population sizes of Q. fabri during the glacial–interglacial periods in the Quaternary. Our results suggest that the Neogene and Pleistocene were important periods for triggering species differentiation and intraspecific diversification in Q. fabri, thereby providing insights into the effects of environmental changes in the Quaternary on the population dynamics of endemic tree species in subtropical China.",06/12/19,29/05/24 10:01,29/05/24 10:01,29/05/24 10:01,2,,1,16,,Tree Genetics & Genomes,,,,,,,,en,,,,,Springer Link,,,,/Users/nelly/Zotero/storage/A6XHBIFX/Chen et al. - 2019 - Phylogeography and population dynamics of an endem.pdf; ,notion://www.notion.so/Chen-et-al-2019-684fd45a1dbd49bbba2597053ef6e9cb,notion,Oak; Chloroplast DNA; Ribosomal DNA; Species demography; Subtropical China,,,,,,,,,,,,,,,,,,,,,,,,,,,,,,,,,,,,,,,,,,,,,,
FFVC34KM,journalArticle,2023,"Semerikova, S. A.; Aliev, Kh. U.; Semerikov, N. V.; Semerikov, V. L.",Phylogeography of Oak Species in the Caucasus Based on Results of Chloroplast DNA Analysis,Russian Journal of Genetics,,1608-3369,10.1134/S1022795423070104,https://doi.org/10.1134/S1022795423070104,"In order to study the biogeography and history of temperate biota of the Caucasian region, one of the centers of biological diversity of Eurasia, the phylogeographic structure of the chloroplast DNA of roburoid oaks (Quercus L., section Quercus, Fagaceae) was studied. We analyzed 926 trees of five species (Quercus robur, Q. petraea, Q. pubescens, Q. hartwissiana, and Q. macranthera) from 70 populations located in different parts of the Caucasus. Sequencing of five fragments with a total length of more than 10 000 bp revealed eight haplotypes, which were typed using chloroplast microsatellite loci (cpSSRs), sequencing, and restriction analysis. The Quercus phylogenetic tree, which includes 34 chloroplast haplotypes of West Eurasian and East Asian roburoid species, confirmed the monophyly of roburoid oaks, which form several lineages that do not have supported topological relationships with each other. The haplotypes identified in the Caucasus belong to two divergent Western Eurasian lineages. These haplotypes are endemic for the Eastern Black Sea and Caucasian region and do not have related haplotypes beyond its borders, which indicates the long-term presence of oaks in the Caucasus and the historical links of the oaks of the Caucasian region with the Eastern Crimea and Eastern Turkey in the absence of chloroplast DNA exchanges with the Eastern European part of the range. The results of the present study show that Caucasian populations could not significantly contribute to the colonization of northern territories and were not influenced by more northern populations, at least through seed transfer. The distributions of the Caucasian haplotypes almost do not intersect with each other, occupying certain geographical areas, which is probably caused by the settlement from individual glacial refugia and genetic drift. The geographical structure of chloroplast DNA variability indicates a long-term presence of oak, in addition to Western Transcaucasia (Colchis refugium), in the regions of the Northwestern, Central, Eastern Caucasus, and Lesser Caucasus. The coincident composition of the haplotypes of the studied Quercus species within the geographic regions indicates the long-term coexistence of different species in different parts of the Caucasus.",01/07/23,30/05/24 8:05,30/05/24 8:05,30/05/24 8:05,669-684,,7,59,,Russ J Genet,,,,,,,,en,,,,,Springer Link,,,,/Users/nelly/Zotero/storage/G7DI5LTR/Semerikova et al. - 2023 - Phylogeography of Oak Species in the Caucasus Base.pdf; ,notion://www.notion.so/Semerikova-et-al-2023-42bbcc6e2f134777988e81fe4401af08,notion,Quercus; population structure; refugia; phylogeography; chloroplast DNA; Caucasus; molecular phylogeny,,,,,,,,,,,,,,,,,,,,,,,,,,,,,,,,,,,,,,,,,,,,,,
